text,label
The U.S. House voted to require states with a history of voter suppression to get federal approval for election-law…,2
Abiomed defends Impella after critical study; shares ahead 5%,1
Gundlach: Trouble Brewing In Debt Markets As The 'Real Turmoil' Is Only Beginning,0
Newmont Goldcorp stock price target raised to $41.50 from $39.50 at B. Riley FBR,1
Lifeblood of Amazon merchants threatened as coronavirus infects Chinese workers,0
Goldman adds Workday to conviction list; shares +1%,1
$SCANX: Gapping up,1
PPG Industries stock price target raised to $113 vs. $105 at BofA Merrill Lynch,1
"The coronavirus will create an ""unprecedented decline in economic activity"" in emerging markets, says Alessandro Re…",0
U.S. exports to China to nearly double in 'totally done' trade deal: Lighthizer,1
"$RNG - RingCentral EPS beats by $0.01, beats on revenue",1
Aurora Cannabis (NYSE:ACB) Stock Dives Breaking Key Support - Live Trading News,0
WTI crude oil slides 1.5% after surprise build in U.S. inventories,0
Retailers may be able to expect a boost from Black Friday sales as consumer sentiment stays strong. Insights via…,1
Crisis Is Rocking Latin America. Peru Is an Island of Uneasy Calm.,2
"Economist Slok sees no U.S. recession, ""benign"" markets in 2020",1
"Paschi Misses Full-Year Income Target, May Cut Costs More",0
"UPDATE: U.S. stocks rose Friday, recovering after three consecutive session of losses by…",1
Medicines Co. shares jump 17% in premarket after report of potential Novartis offer,1
$PYX - Pyxus International misses on revenue,0
$UXA:COM $CCJ $URG - Uranium likely to benefit as top miner cuts output,1
Neptune Wellness and Canopy Growth agree to amend terms of cannabis processing deal,2
Royal Caribbean stock price target cut to $100 from $135 at CFRA,0
"As a reminder, JPMorgan remains the riskiest bank with the highest GSIB score of any bank and a 4.0% surcharge.",0
"Fiesta Restaurant Group, Inc. to Appoint Andrew Rechtschaffen to the Board as Independent Director",2
"When the market sells off quickly like this morning, it is quite common to undercut the prior low by a few pennies...",0
"Highlight: Michael Bloomberg ""is trying to kind of bring the party together— shift the focus a little bit,""…",2
$FGB - First Trust Specialty Finance&Financial Opportunities Fund declares $0.135 dividend,2
$VDAHF - Vinda International: Favorable Tailwinds Persist. #business #stockmarket #economy,1
GFT Technologies : suspends forecast for the current financial year and reviews dividend p... #GFTTechnologies…,0
Broadcom +2% after Street-high target,1
A troubled Chinese state-own firm is giving bondholders a stark choice on $1.25 billion of dollar bonds,2
"$SUMRX: Asian Markets Close: Nikkei +0.8%, Hang Seng +1.5%, Shanghai +0.7%",1
AT&T downgraded by MoffettNathanson to sell on concern wireless can't carry the whole company,0
Why Ball Corporation Stock Gained 12% in January,1
$PLSQF - Plus500 rockets 40% as revenue soars nearly 500% in Q1,1
Tyson Foods Q1 pork sales rose 7.3% to $1.38 bln,1
"Fed's ""National Activity Index"" Plunges To 2-Year Low",0
"Graphic video showed a vehicle drive into a crowd of Chilean protesters, where at least 5 were injured",2
"This winning stock-market bet was soured by the coronavirus crisis, and now it's setting up for a rebound",1
4 ways to help blended families navigate finances #investinyou (In partnership with .),2
What Tesla taught Ford by,2
"An ugly anti-Chinese strain is infecting the Hong Kong protests and driving away potential allies, says …",2
$EVH $PGNY $JG - Domo and Evolent Health Tech gainers; GlobalSCAPE and Yext among losers,2
"Russia pours cold water on U.S. and European plans for swift reconciliation between Serbia and Kosovo, with Moscow’…",2
Here is What Hedge Funds Think About Xencor Inc (XNCR),2
"A take-private is exactly what it sounds like, but here's a more in-depth explanation",2
$SLB - Schlumberger goes ex-dividend tomorrow,2
"All Smoker Black Friday 2019 Deals: List of Masterbuilt, Weber, Pit Boss & Cuisinart Smoker & Combo Grill Deals Rel…",2
American Resources reports Q3 results,2
Bayer asks California court to reverse $86 mln Roundup cancer verdict,2
INVESTOR ALERT: Law Offices of Howard G. Smith Announces the Filing of a Securities Class Action on Behalf of HEXO…,0
Earnings Preview: What To Expect From Macy’s On Thursday,2
"U.S. interest positive for Ericsson, says top owner Cevian",1
$PSTV could squeeze over 2.25,1
"Stock Market Update: Macy's shares slide on retail weakness, potential credit card breach",0
Hero MotoCorp Q3 Results: Profit Beats Estimates Despite Lower Sales,2
The Dow has rallied 6% today as investors react to early signs that lockdowns in the U.S. and Europe may be helping…,1
"$PHUN Mobile advertising company Phunware(PHUN) has landed President Trump's re-election campaign as a client, the…",2
"Bumble Bee Foods filed for bankruptcy, blaming its ""recent and significant legal challenges.""",0
$ENOB - Enochian Bio +18% premarket on acquiring exclusive license for HBV,1
VIX Warns Of Imminent Market Correction,0
China Virus Crisis Roils Supply Chains for Global Manufacturers,0
Hedge Funds Aren’t Crazy About Hutchison China MediTech Limited (HCM) Anymore,0
Fed's Mester says policymakers want to prevent 'lasting damage' to the economy,2
Mexico Official Complains About 3-Way Trade Deal in Tweetstorm,2
"AUD/USD, NZD/USD, USD/CNY – Markets Quiet as Investors Look for Trade Talk Clues",2
Salesforce to use Amazon AI technology to improve call center services,2
Bernie Sanders Builds Big Primary Machine to Win Prized California,2
Analysts See 18% Gains Ahead For The Holdings Of The First Trust Dow Jones Internet Index Fund ETF,1
Strong demand for the small business relief program is “a really good sign for what the economy might look like 2-3…,0
"Yellen Blames ""Enormous Debt And Buybacks"" For Coming Default Wave; Morgan Stanley Says It's All The Fed's Fault",0
$HSBC - HSBC to pay $192M under deferred prosecution agreement,2
Simon Property to buy mall owner Taubman in $3.6bn deal,2
Lululemon stock price target raised to $260 vs. $222 at Susquehanna,1
"Very Optimistic About 2020, Says Bank Albilad CEO",1
"ArcelorMittal Surges as Steel Outlook Brightens, Debt Drops",1
"Algeria to cut oil output by 12,000 bpd under new OPEC deal #economy #MarketScreener",1
Nordstrom : Hiring for the Holidays #Nordstrom #Stock #MarketScreener,2
The U.S. Is Firing Blanks Against a New Iranian Threat,2
$LULU: Barclays starts at Overweight,1
Stock Market Update: Disney Leads Dow Higher In Sideways Trade,1
Wall Street set for higher open as trade deal hopes build,1
$MPLX $MPC - MPLX cut at Credit Suisse on potential dilution from Marathon strategic review,0
"S&P 500 headed for a 67% downturn? Seems ‘preposterous’ now but so did similar pullbacks begun in 2000 and 2007, sa…",0
Some Galliford Try (LON:GFRD) Shareholders Are Down 46%,0
Rapt Therapeutics down 9% premarket after pricing equity offering,0
"Hedge Funds Are Cashing Out Of Banc of California, Inc. (BANC)",0
Europcar nears rescue deal with lenders - source #economy #MarketScreener,2
Credit Suisse CDS jump after CEO Thiam quits,1
Bank of Jamaica 14-Day Repo Auction Results -10 February 2020 #Stock #MarketScreener,2
Pinduoduo stock sinks on heavy volume after earnings,0
$SONO: Sonos displaying relative strength as shares jump 8% to 52-week highs in the wake of Wednesday's earnings...,1
Elon Musk said it best: “Oh my f. . .g God.”,2
Japan Approves Ship Dispatch for Middle East Intel Gathering,2
Stock market news live: Stocks hit record highs after China announces plans to cut tariffs on $75 billion in US goods,1
US Fed admits Libra has potential to ‘rapidly’ achieve mass adoption,2
Alphabet and Facebook price targets cut at Barclays on weaker ad outlook,0
Nomura : ING working on digital assets custody technology - sources #Nomura #Stock #MarketScreener…,2
YPF Sociedad Anonima (YPF): Hedge Funds Are Snapping Up,1
TJX Q3 EPS 68 cents vs. 61 cents a year ago,1
Americans aren't having as much sex or as many children as they used to. That could be a serious economic problem…,0
$TALKX: Market Briefing: Broad-based jump on employment data,1
Tokyo's 2020 Olympic Stadium,2
"S&P 500, Nasdaq notch records to end the week as market weighs merits of limited China trade-deal",1
Oil majors cut 2020 spending by 22% after prices slump #CNOOC #Stock #MarketScreener,0
Some expect natural gas prices to fall to levels not seen in three years,0
Credit Suisse shares slump after Thiam's resignation,0
$GTX: Garrett Motion withdraws FY 20 guidance,0
Power Financial shares jump on buyout offer by parent,1
"Tesla shares rise as Musk says Cybertruck orders hit 200,000",1
"BofA Upgrades WestRock After Containerboard Conference, London Pulp Week",1
"Stocks - Tiffany, Disney, Tesla Rise Premarket; Uber Falls",2
Heat Biologics started at buy with $1 stock price target at Maxim Group,1
Stock Market Update: Facebook seeing increased buying interest,1
$ALT strong all day on volume abv average.,1
"Who's watching our behavior, and what are they doing with this information? and explain.…",2
Some expect natural gas prices to fall to levels not seen in three years,0
"McDonald's could be the key to $1 billion in sales for Beyond Meat, UBS says by",1
A Preview Of Philip Morris Intl's Q4 Earnings,2
New for subscribers: Morgan Stanley adds Amazon to its list of favorite stocks. Here are the rest...,1
"Highlight: ""We have high confidence that we've seen what we call the internal low for the market,"" Chief…",1
Trade Alert - Crude Oil Downside. Read more: #investing #stockmarket #trading,0
$UGI - UGI declares $0.325 dividend,2
$DDF - Delaware Investments Dividend & Income Fund cuts dividend by 10%,0
Uber may be about to lose the right to operate in London,0
Wall Street has slammed the brakes on one of 2019’s hottest stock-market funds,0
Oil lower but trims early loss as report on China trade talks sparks fresh hope,1
U.S. deficit soars to $342 billion in two months via,0
$MDGL - Madrigal: A Stellar Stock For This Coronavirus Bear Market. #finance #stocks #investing,1
"Bags of rice, cellphone credit and mobile phones were just some of the freebies that politicians handed out ahead o…",2
"Ending joint filing would lead to a 15.5 percentage point jump in women's labor-force participation, the IMF found…",1
Will China Declare Force Majeure If Virus Situation Worsens?,2
$WDAY - Workday reveals Products exec shuffle,2
Expect A Weaker Dollar In 2020. Read more and sign up for updates: #economy #stockmarket #trading,0
$CLR - Continental Resources: Still Going Strong. #stocks #business #trading,1
"As Uber, GrubHub and Postmates battle over cities, Doordash is thriving in the suburbs",1
FDA accepts Bioepis' application for Avastin biosimilar,1
Cadbury Candy Maker Sees ‘No Stopping of Growth’ in Demand,2
Brent +4%,1
The Places With China Travel Restrictions Due to Coronavirus Outbreak,2
"SAIC to Acquire Unisys Federal in Accretive, Strategic and Value Creating Transaction",2
"Hackers have gained access to thousands of Disney+ user accounts, selling them for between $3 and $11, according to…",0
Is Nicox (EPA:COX) Using Too Much Debt?,2
Uber's license will not be renewed in London over safety concerns,0
U.S. Marriages Rising as Same-Sex Couples Now Counted in Report,1
New York Mortgage estimates year-end BV at $5.77-$5.79 per share,2
"Global shares gain, oil rises, but caution lingers on U.S.-China deal",1
Will smart machines kill jobs or create better ones?,2
Coronavirus crisis spells trouble for many Egyptian breadwinners #economy #MarketScreener,0
China International Marine Containers : ANNOUNCEMENT OF POLL RESULTS OF THE SECOND EXTRAOR... #Stock…,2
"Merger Arbitrage Analysis And Spread Performance - November 24, 2019. Read more and sign up for updates:…",2
"Hedge Funds Have Never Been This Bullish On HarborOne Bancorp, Inc. (HONE)",1
Bluebird bio stock price target cut to $86 from $172 at Evercore ISI,0
Huawei Sues Verizon in U.S. for Multiple Patent Violations,0
Senate to vote on calling witnesses in Trump impeachment,2
So you crashed your $3 million Bugatti. Now what?,2
Here's the level to watch in Texaco as stock falls on London ban $UBER (via ),0
What is a cyclical stock? A defensive one? Here's the answer:,2
Twitter quarterly revenue tops $1B for first time,1
$MSGN - Imperial downgrades MSG Networks amid sports-free airwaves,0
Mercury General : Insurance Urges Americans to Take Extra Precautions to Secure Home Netwo... #MercuryGeneral…,2
"$QQQ April $204 call open interest rises to 32,443 after 20,000 bought for $0.94 yesterday morning, then 10,000 at…",1
Dow Rallies on Signs Coronavirus Pandemic Is Slowing Worldwide,1
$TWLO - Twilio gets Street-low target on virus risk,0
"The Dow closed 1,627.46 points higher, or more than 7%, as the number of new coronavirus cases in the US appeared to slow down",1
Welltower stock price target cut to $90 from $95 at J.P. Morgan,0
$LOW - Lowe's racks up another positive rating despite recession risk,1
"EasyJet seeks to ""do the right thing"" offsetting emissions, critics say fly less",2
"If You Had Bought Manhattan Bridge Capital (NASDAQ:LOAN) Stock Five Years Ago, You Could Pocket A 118% Gain Today",2
Wall Street Warnings Get Louder Now the Everything Rally Is Back,0
Chubb to purchase additional 15.3% stake in Huatai Insurance,2
Why Campbell Soup Company's (NYSE:CPB) High P/E Ratio Isn't Necessarily A Bad Thing,1
"Gun Control Groups Hide Behind Bogus ""Police"" Think-Tank To Disarm Americans",2
"Brussels restaurant 65 Degres has become the city’s best-rated eatery, largely thanks to rave reviews of its staff,…",2
Sympathy strikes ground flights and bring havoc to commuters in Finland,0
Did Service Corporation International's (NYSE:SCI) Share Price Deserve to Gain 96%?,2
Off-price retailer TJX shares rise after earnings and sales beat expectations,1
U.S. consumer debt grew in February by the most in 7 months,0
"Oil Slips After OPEC, EIA Reports Forecast Robust Supply #WTI #Stock #MarketScreener",0
"Elon Musk says Tesla has 187,000 orders for its Cybertruck, less than 48 hours after the broken-glass reveal",1
Performance Food Group Company to Participate in the 2020 CAGNY Conference,2
Materials Down On Mixed Trade-Negotiations Messages -- Materials Roundup #economy #MarketScreener…,0
Buddhist monks at this Bangkok temple are using plastic bottles to make their robes,2
U.S. Well Services initiated at buy with $3.50 price target at Stifel,1
Retail Still Front And Center As Holiday Week Kicks Off,2
$ECONX: January Chicago PMI 42.9 vs 48.7 consensus; December 48.9,2
Boeing’s stock is headed for its 12th decline in the past 14 sessions,0
Napco Security stock price target cut to $30 from $35 at Imperial Capital,0
A few things to watch heading into the holiday week:,2
Coronavirus Hits Oil's Weakest Credits Hardest,0
"$OMAB - OMAB Hammered As Covid-19 Bites Into Air Travel, But A Possible Contrarian Buy. #finance #investing #economy",0
Video of Serena Williams & Olympia Dancing to Pampers’ “Wild Child Wiggle” Available on Business Wire’s Website,2
Banks could lose over $100 Million from loan made to China's Luckin Coffee chairman,0
Hanesbrands declares $0.15 dividend,2
Since we rallied today due to the virus slowing down in KEY STATES (NY) will the Cuomo pressers be market-moving events?,1
"CEE MARKETS-Forint regains ground before rate meeting, leads FX higher",1
"This 24-year-old is earning $230,000 a year—here are the 3 steps he's taking to become a millionaire by 30. (via…",2
Molson Coors said to be weighing sale of European business,2
Bioteq Environmental Technologies reports Q3 results,2
21Vianet Group misses on revenue,0
$POIA this is a great PR. I would not be surprised seeing this stock trading above $2 in after-hours.,1
Kohl's cuts annual profit forecast after disappointing results; shares slump,0
Curaleaf Q3 top line up 27%; non-GAAP EBITDA up 169%,1
STOCKS AT THE OPEN: - Dow up 0.21% - Nasdaq up 0.48% - S&P up 0.26%,1
$ENDV - Endonovo up 35% on SofPulse collaboration,1
"Exxon Stock Still Solid and Undervalued, but the Market Doesn’t Seem to Care - Investorplace.com",2
Bed Bath & Beyond reiterated as buy at BofA Merrill Lynch,1
JUST RELEASED: Oil Price Dynamics Report Oil prices fell over the past week owing to increased supply.…,0
Live Nation Falls After Report DOJ Is Preparing Legal Action,0
"Dow futures gain 129 points, or 0.4%, S&P 500 rise 13 points, or 0.4%",1
You might not need as much sleep as you think.,2
Drugmaker Sanofi expects further profit growth from narrowed focus,1
While market strain triggered by the coronavirus pandemic has eased since the Federal Reserve's historic interventi…,1
Analysts question Silicon Motion's margin outlook,0
"Stranded tankers, full storage tanks: coronavirus leads to crude glut in China #economy #MarketScreener…",0
$SONN up after hours on no news. Tempting but got to check if it has warrants and how clean the share structure is.…,1
Gorman-Rupp slips 6% post Q4 results miss,0
The SEC issued suspension orders for dental supplier No Borders Inc. and apparel maker Sandy Steele Unlimited Inc.…,0
"""I’ve owned the Apple Card for 3 months…this is why it sucks.""",0
Jobless claims hit multi-year low,1
$ADXS Yes SIR !!!!!!!!!! New HOD !!!! $EARS wants higher. Looking good for next week.,1
"OPEC and Russia have postponed a meeting to discuss #oil output cuts until April 9, sparking a price drop in overni…",0
Tesla Set to Bulk Up the World’s Largest Lithium-Ion Battery,2
The #market is seeing strong #tax-loss selling. #Investors who focus on price action are worried.…,0
Wall Street slips from record highs at open after jobs report,0
"3 Mutual Fund Misfires to Avoid - February 06, 2020",2
Nasdaq hits new high as investors look beyond coronavirus,1
Becton Dickinson downgraded to sector weight from overweight at KeyBanc Capital,0
Gilead's Second CAR-T Treatment Suffers the Same Issues as Yescarta,0
Credit Suisse's James Sweeney expects a modest move higher in core inflation,0
Better Marijuana Stock: Cresco Labs vs. Green Thumb Industries,2
"Highlight: Michael Bloomberg ""is trying to kind of bring the party together— shift the focus a little bit,""…",2
Apple delaying the theatrical release of “The Banker” after one of the movie’s producers was accused of assault by…,2
"Nike will no longer sell its items directly to Amazon, as it looks to revamp its retail strategy by selling just to…",2
"Australia Cuts Forecasts for Wage Increases, Economic Growth and Budget Surplus",0
The #market is seeing strong #tax-loss selling. #Investors who focus on price action are worried.…,0
Analysts question Silicon Motion's margin outlook,0
Ebay shares jump 3% premarket,1
"$ECONX: November Average Hourly Earnings M/M +0.2% vs +0.3% consensus, prior +0.36% from +0…",1
DFND,2
"""The separation will better empower each company to fully embark upon its unique path for growth.""",2
"UPDATE: U.S. stocks rose Friday, recovering after three consecutive session of losses by…",1
$NDAQ - Nasdaq prices 600M of 0.875% senior notes,2
"Should You Worry About AcelRx Pharmaceuticals, Inc.'s (NASDAQ:ACRX) CEO Salary Level?",2
"ICYMI: Actually, Teslas are among the *least* stolen vehicles.",2
"Corporate profits are flat in 2018, S&P is up 24%, or as Goldman says ""these returns likely would not have been pos…",2
"Energy has gone nowhere in the past decade, and it could get worse before it gets better",0
The facts pile up against Trump in impeachment inquiry,2
Amazon’s Cloud Battle With Microsoft Weighs on AMZN Stock,0
4 ways Washington is set to change how you save for retirement,2
$CBAY (-76.9% pre) CymaBay Therapeutics Halts Clinical Development of Seladelpar - GN,0
Canada Goose stock price target cut to $50 from $65 at CFRA,0
Cynata Therapeutics : CYP Files Application to Commence Phase 2 CLI Clinical Trial #CynataTherapeutics #Stock…,2
"$PPLT $PLTM $PTM - Palladium roars to record $1,900/oz. on South Africa power cuts",1
Take-Two downgraded on murky game slate,0
Twitter's First Billion-Dollar Quarter,1
Hedge Funds Are Selling Franks International NV (FI),0
PPG Industries stock price target raised to $113 vs. $105 at BofA Merrill Lynch,1
Sea level rise will flood the homes of around 300 million people by 2050,2
"$CX - Cemex cut at Credit Suisse, J.P. Morgan on weak building outlook",0
Amazon and Goldman Sachs Wade Deeper Into Financial Services,2
"Ford Stock Hit by CEO, China and Lack of Product",0
Diffusion Pharma up 23% after hours on positive TSC data,1
DO & : DGAP-DD DO & CO Aktiengesellschaft english #DOCOAktiengesellschaft #Stock #MarketScreener…,2
SoftBank's Oyo reveals over $330 million annual loss; revenue surges: valuation report,2
Administration Proposal to Create a Uranium Reserve Addresses a Glaring Vulnerability #Stock #MarketScreener…,2
$GE (+0.3% pre) GE brings in shipper Maersk's CFO as finance head - Reuters,1
"$GPP - Green Plains Partners EPS misses by $0.01, misses on revenue",0
"Gorman-Rupp EPS misses by $0.06, misses on revenue",0
Asian Shares Soar Amid Trade Optimism,1
Eagle Point Income Company reports Q3 results,2
Vans parent VF Corp. says China stores still open have seen 'significant' declines in retail traffic,0
Watch $MARK over 43c in after-hours for continuation targeting the 50c area initially,1
Press release on the Monetary Council meeting of 7 April 2020 #economy #MarketScreener,2
"Paul Tudor Jones Sees the Potential for a Stock Market Explosion, to the Upside",1
Gorman-Rupp slips 6% post Q4 results miss,0
"The Dow closed 1,627.46 points higher, or more than 7%, as the number of new coronavirus cases in the US appeared to slow down",1
Why Hecla Mining Is a Buy,1
Orbcomm price target lowered to $9 at Canaccord,0
"Introducing Lannett Company (NYSE:LCI), The Stock That Tanked 80%",0
"U.S. consumers fear for jobs, debt payments because of coronavirus: New York Fed survey",0
$SGBX holding overnight..... its a matter of time here... Chart looks perfect.,1
$BCC - Boise Cascade declares $0.10 dividend,2
UPDATE 1-Brazil's real posts lowest ever close of 4.2061 per dollar,0
Fun fact: there are about 35 million people still in credit-card debt from last year’s round of holiday shopping. H…,0
$COENF $COENY - Contact Energy declares NZ$0.16 dividend,2
Joe Biden's campaign is determined to fight past Tuesday's New Hampshire primary,2
Elastic +3.7% as Canaccord turns bullish,1
"EBAY STUBHUB SALE DONE AT 25X EBITDA, CNBC'S FABER SAYS",2
Collegium launches convertible debt offering; shares down 10%,0
Popular Irish ETF skids lower after Sinn Fein election win,0
Amazon Employees Surge Toward 1 Million,1
"China Becomes Top Filer of International Patents in 2019 Amid Robust Growth for WIPO's IP Services, Treaties and Fi…",1
Used Vehicle Market Softens in October as Wholesale Volume Spikes,2
"Exxon Stock Still Solid and Undervalued, but the Market Doesn’t Seem to Care - Investorplace.com",2
Coronavirus Hits Oil's Weakest Credits Hardest,0
Whirlpool -2% after large recall in U.K.,0
Canadian consumers filed the largest number of insolvencies in almost a decade at the end of last year,0
$AES - AES Is A Soft Buy. Subscribe to Seeking Alpha for more: #business #economy #stockmarket,1
Is Industrial Logistics Properties Trust (ILPT) A Good Stock To Buy?,2
Why You Might Be Interested In TMX Group Limited (TSE:X) For Its Upcoming Dividend,1
Democrats need to realize that impeaching Trump may not accomplish anything at all,2
Biogen stock price target raised to $410 from $350 at SVB Leerink,1
$CIEN - Ciena's Drivers Help Offset Some Of The Covid-19 Uncertainty. #economy #stockmarket #stocks,1
Autoliv -2% after setting new targets,0
$HSC: Harsco sees Q1 adjusted EBITDA at high end of guidance range of $43-48 mln,1
"New York City will have enough N95 masks for the week but still faces other coronavirus shortages, Mayor says",2
"The China-driven growth in beef consumption may soon be over, shows (via )",0
Stock futures move higher as trade deal hopes rise,1
$AL - Remain Cautiously Optimistic On Air Lease Even After Major Correction. #finance #stocks #business,1
Edited Transcript of ESE earnings conference call or presentation 19-Nov-19 10:00pm GMT,2
Goldman Sachs tells clients it is time to buy gold,1
Is Alnylam Stock a Good Buy Now?,2
$SLB - Schlumberger: Value Beginning To Emerge After Shares Halved Yet Again. #stockmarket #stocks #business,1
$BLPH - Bellerophon Therapeutics EPS misses by $0.33,0
Illinois’s Legalized Pot Sales Debut Beats All States Except One,2
The Ra Medical Systems (NYSE:RMED) Share Price Is Down 81% So Some Shareholders Are Rather Upset,0
Some Galliford Try (LON:GFRD) Shareholders Are Down 46%,0
Thiel driving FB division on political ads - WSJ,0
Bluebird bio stock price target cut to $86 from $172 at Evercore ISI,0
Autodesk downgraded to underweight from neutral at JPMorgan,0
New York joins states suing e-cigarette maker Juul,0
Security Federal Corporation Completes Private Placement of $30 Million of Subordinated Notes,2
"Twitter tops expectations with first $1 billion quarterly revenue, but outlook lags",1
These Hedge Funds Snapped Up AVX Corporation (AVX) Before Q4 Rally,2
Germany Fines Steelmakers 646 Million Euros for Price Fixing,0
JUST RELEASED: Oil Price Dynamics Report Oil prices fell over the past three weeks owing to decreased demand and…,0
Aramco indicative share price up slightly to 37 riyals,1
GoldON Resources : Grants Incentive Stock Options #GoldONResources #Stock #MarketScreener,2
California is slapping CVS with a $3.6 million fine for not following state recycling laws,0
Energy Down With Energy Futures -- Energy Roundup #NYMEX #Stock #MarketScreener,0
Luxury giant LVMH is reportedly nearing an agreement to add Tiffany & Co. to its portfolio. The acquisition deal wo…,2
Energy tops sector leaderboard on trade optimism,1
