text,label
"Boeing unveils largest version of its embattled 737 Max plane, despite crisis",2
Evercore downgrades bluebird bio and Clovis in premarket analyst action,0
New York State AG investigating WeWork,0
Airbnb to terminate $1 billion credit facility after private equity deal: sources,2
AT&T shares sink after MoffettNathanson downgrade,0
$TBVPY - Thai Beverage: Deleveraging Is Key Priority With A Potential Listing Of Beer Business. Continue reading:…,2
Centennial was designed as an anti-wildfire fortress. But ecologists say the project is more like “hubris” in the f…,2
Collegium launches convertible debt offering; shares down 10%,0
Juiced Bikes Scorpion Is An E-Bike With A Motorcycle Spirit,2
Sales of Latin American oil cargoes to China have ground to a halt this week,0
GS Acquisition : Vertiv Announcement Call Presentation #GS #Stock #MarketScreener,2
Here's Why I Think Microsoft Is a Better Buy Than Amazon,2
Trade momentum rose in September for the first time in four months,2
Exxon Says N.Y. Used Fraud Claims to Score Political Points,2
"U.S. Jobs Top Estimates With 225,000 Gain, Wages Accelerate",1
$AKCA (+1.0% pre) Akcea and Ionis $IONS launch late-stage AKCEA-TTR-LRx study - SA,1
$DHR hits Scan as tries to crack consolidation channel #IBDPartner a break out buy over 148…,2
"Ford Recalls More Than 500,000 Pickups for Fire Risk",0
United Nations Global Compact : issues new report to help companies advance human rights…,2
"$HPQ: HP sends letter to Xerox (XRX), reiterates rejection of proposal",2
"Paschi Misses Full-Year Income Target, May Cut Costs More",0
GBP/USD Price Forecast – British Pound Fails To Break Major Barrier,0
Uber stock price target raised to $54 from $50 at Deutsche Bank,1
"Oaktree Specialty Lending NII misses by $0.02, misses on total investment income",0
$COP - ConocoPhillips seeking sales of Alaska assets - report,2
WATCH: Why is 2019 on pace to be the largest year ever for healthcare technology? Investment Banking…,1
Meta Financial declares $0.05 dividend,2
$PACB - Pacific Biosciences Still Can't Catch A Break. #trading #economy #business,0
$JOUT - Johnson Outdoors Inc. (JOUT) CEO Helen Johnson-Leipold on Q1 2020 Results - Earnings Call Transcript....,2
Vanguard Real Estate $VNQ sweep buys 4450 January $60 puts to open $4.90 to $5 offers after it retested a key support break this week,0
$SOYB $MOO $FTAG - Soybeans rebound as China trade talks make progress,1
Results: KLA Corporation Beat Earnings Expectations And Analysts Now Have New Forecasts,1
$TRXC - TransEnterix up 2% after hours on $25M stock sales deal,1
Oil slips but holds near 2-month high as looming OPEC meeting expected to yield deeper cuts,0
RECAP 11/22 Unusual Puts: $WMT Jan 120 P $BTU Feb 9 P $UBER Dec 28 P $GPS Mar 14 P $SPCE Dec 7.5 P $OLLI Dec 65 P…,0
"Hedge Funds Are Souring On Compass Minerals International, Inc. (CMP)",0
Can Alternative Investing Combat Market Blues?,2
"Honda Motor EPS misses by ¥10.43, beats on revenue",2
$AMBA - Ambarella Will Be Hard Pressed To Keep Going At Its Current Pace. Read more:,0
Equinor misses on revenue,0
L BRANDS MEETING WITH BANKS TO CONSIDER ALTERNATIVES: THE DEAL... to the Victoria Secret show?,2
Markets Uncertain After Messy China-U.S. Deal Rollout (Podcast),0
$PSTV they found it !!!,2
Silvercorp -20% as quarterly silver sales volumes remain flat,0
$AMCR - Amcor goes ex-dividend tomorrow,2
"$SUMRX: Asian Markets Close: Nikkei +0.8%, Hang Seng +1.5%, Shanghai +0.7%",1
"AQST, PHR among premarket losers",0
STOCKS NOW: - Dow up 120.52 points - Nasdaq up 4 - S&P up 5.91,1
Argentine bonds surge after investors call Buenos Aires' bluff,1
Nasdaq opens 34 points or 0.4% higher,1
Edited Transcript of ASND earnings conference call or presentation 18-Nov-19 9:30pm GMT,2
$PSTV could squeeze over 2.25,1
"Gorman-Rupp EPS misses by $0.06, misses on revenue",0
A Sliding Share Price Has Us Looking At Chi Ho Development Holdings Limited's (HKG:8423) P/E Ratio,0
"Becton, Dickinson EPS beats by $0.01, beats on revenue",1
$1 gasoline is back -- and it's a terrible sign for the economy,0
McDonald's to pay $26 million to settle California wage lawsuit,1
"Comparable sales missed estimates at Home Depot, shares down 4.6% premarket",0
Wall Street bounces back from a steep sell-off. Here's what to expect next (via ),1
South Africa could fall deeper into junk territory after S&P cut the outlook on its assessment of the nation’s debt…,0
"$TARO: Taro Pharm CFO Mariano Balaguer is leaving to accept the position of CFO at another company, effective...",2
Trump Warms to Doing China Trade Deal Soon Ahead of Key Meeting,1
Fiat settles tax issue in Italy,1
"Gold prices move up as focus turns to Fed meeting, China trade deal",1
$SPY $AMTD $SCHW $TIF $MDCO $NVS $EBAY,2
Peoples Financial Services declares $0.36 dividend,2
Best Income Ideas From Around The Web: November 25 Edition. Subscribe to Seeking Alpha for more:…,2
$SOYB $MOO $FTAG - Soybeans rebound as China trade talks make progress,1
Prothena up 8% on Evercore upgrade,1
Fed Liquidity Drain Spoils Virus-Surge-Inspired Stock Buying-Panic | Zero Hedge,0
Wall Street slips from record highs at open after jobs report,0
U.K.'s Johnson to Spend 5 Billion Pounds on Bus Service Overhaul,2
"{Free} Macro Week in Review/Preview November 22, 2019, on the blog and here $SPY $IWM $QQQ…",2
"Today, the IMF Executive Board approved a disbursement of €176.5 million to #NorthMacedonia. This financial suppor…",2
Edited Transcript of MMS earnings conference call or presentation 19-Nov-19 2:00pm GMT,2
Pharmaron Beijing : An announcement has just been published by the issuer in the Chinese s... #PharmaronBeijing…,2
A sterling surge after the UK election could be short-lived as Brexit gets even more complicated,1
MAXIMUS -2.9% post Q4 results,0
"Apple is using a new app to get volunteers for research on hearing, heart disease and women's health.",2
Bank of Ireland cuts key profit target as low rates take toll,0
X FINANCIAL INVESTOR ALERT: Wolf Haldenstein Adler Freeman & Herz LLP announces that a securities class acti…,0
Opera Limited Just Beat Earnings Expectations: Here's What Analysts Think Will Happen Next,1
"Highlight: “The U.S. consumer… [has] continued to de-lever,” notes AngelOakCap’s Sam Dunlap. “That’s really… what w…",2
Markets trending lower despite positive jobs report,0
Continual Technological Advancements Land Innovator In FreightTech 25,2
Did you know Black Friday starts today? Probably OK to delete every email today site-unseen,2
Walmart's Jet is ending its fresh-food delivery business just a year after introducing the service in New York City,0
"$CMP - Compass Minerals EPS misses by $0.12, misses on revenue",0
S&P Global stock price target raised to $322 from $274 at Stifel Nicolaus,1
Edited Transcript of ESTE earnings conference call or presentation 7-Nov-19 5:00pm GMT,2
$ubio needs some attention .... super steep,2
JPMorgan anticipates ‘disorderly’ year-end funding pressures again as banks retrench,0
$HEPA Hepion Pharmaceuticals Successfully Advances to Next Dosing Level in Ongoing Multiple Ascending Dose Clinical Study of CRV431,1
$AMTD (+1.3% pre) Charles Schwab $SCHW to buy TD Ameritrade in $26 billion all-stock deal - Reuters,1
Ebay confirms StubHub sales to Viagogo for $4.05B,2
Kellogg stock falls after weak guidance,0
$ITCI - Intra-Cellular Therapies: This Small Cap Biotech Will Not Be Small For Long. #economy #investing #markets,1
Trade Desk $TTD strong with 900 December $275 OTM calls bought $2.70 to $2.95 early,1
Schweizerische Nationalbank : Switzerland Loses Grip on World's Lowest Borrowing Costs -- ...…,0
$TIF France's LVMH close to buying Tiffany after sweetening offer,2
3Y Auction Tails On Muted Buyer Demand Despite Unlimited Fed QE,0
Rush to Green Sparks Concern of Bubble in ESG Assets,0
"La Jolla shares fall on CEO departure, clinical trial results",0
AT&T downgraded by MoffettNathanson to sell on concern wireless can't carry the whole company,0
Oil Bankruptcies Are Reaching Worrying Levels,0
TJX's stock gains 1.1% premarket after Q3 results,1
Nasdaq up 0.2%,1
"Real Selling Begins As CTAs Start Liquidating, Dealer Gamma Flips Negative",0
GFT Technologies : suspends forecast for the current financial year and reviews dividend p... #GFTTechnologies…,0
India IIP Data: Industrial Production Contracts 3.8% In October,0
Imagine Owning Hersha Hospitality Trust (NYSE:HT) While The Price Tanked 51%,2
Not So Happy Holidays for Kohl’s After Earnings,0
$DEX - Delaware Enhanced Global Dividend & Income Fund cuts dividend by 7%,0
Is Trump Preparing A New Iran Nuclear Deal?,2
$ORLY strong up 11.7% into large volume pocket w/ room to $360,1
$XERS - Xeris Pharma launches equity offering; shares down 3% after hours,0
"US Gasoline Crashes To 50c - Lowest Since 2001 - Amid ""Unprecedented"" Demand Collapse",0
Edited Transcript of BMY earnings conference call or presentation 31-Oct-19 12:30pm GMT,2
Sales of Latin American oil cargoes to China have ground to a halt this week,0
Theravance readies $150M stock offering; shares down 5% after hours,0
"Cboe Global Markets EPS beats by $0.08, beats on revenue",1
"The Impeachment Scam is driving Republican Poll Numbers UP, UP, UP! Thank you Shifty.",2
"$IQ - I can see this house doing well, but I'm not playing. Chart is too chaotic.",2
Watch Live: Fed Chair Powell Avoid Admitting QE4 Has Begun & Repocalypse Is Imminent,2
Abiomed defends Impella after critical study; shares ahead 5%,1
U.S. stock futures fall on worries over China trade talks,0
Oslo Børs VPS : Rate Fixing NO0010861081 2019-11-25 #OsloBørsVPS #Stock #MarketScreener,2
$TOPS TOP Ships (TOPS) Stock Is Rocketing For Multiple Reasons via,1
Bank of England activates emergency liquidity measure,2
Equipment and Event Rental Industry in the U.S. Continues Steady Growth Pattern,1
Inside CannTrust: Whistleblower reveals new video of alleged illegal grow room by…,2
$XPEL - Xpel Inc: Racing With Exceptional Risk/Reward. #business #economy #stocks,2
"Tesla's stock falls 2.1% premarket, after tumbling 17.2% on Wednesday",0
"Civista Bancshares EPS misses by $0.01, misses on revenue",0
Carvana Brings The New Way to Buy a Car™ to Utah,2
Why Myriad Genetics Shares Are Tanking Today,0
A sterling surge after the UK election could be short-lived as Brexit gets even more complicated,1
$EXC - Exelon Q4 2019 Earnings Preview,2
$HSBC - HSBC to pay $192M under deferred prosecution agreement,2
California is slapping CVS with a $3.6 million fine for not following state recycling laws,0
Not So Happy Holidays for Kohl’s After Earnings,0
Tinyclues accélère sa croissance en 2019,2
Did You Manage To Avoid Golden Minerals's (NYSEMKT:AUMN) Devastating 71% Share Price Drop?,2
$O - Realty Income: Creates An Attractive Buying Opportunity. #stocks #trading #finance,1
Fed Chairman Jerome Powell says central bank 'watching carefully' as firms brace for wave of missed mortgage paymen…,2
Facebook just nabbed a major player for its gaming platform as it continues to ramp up efforts to compete in the vi…,2
Three keys to avoiding new debt with a new baby #investinyou (In partnership with .),2
"BCE EPS misses by $0.01, misses on revenue",0
"""Fade The Rip"": BofA Warns ""Bear Market Far From Over Unless We Escape A Recession""",0
$TWLO - Twilio gets Street-low target on virus risk,0
Taronis Technologies reports Q3 results,2
Hedge Funds Have Never Been Less Bullish On MDC Partners (NASDAQ:MDCA),0
Morgan Stanley bullish on Eldorado Resorts ahead of Caesars combination,1
Baird likes drug wholesalers in premarket analyst action,1
"Hedge Funds Are Selling Schneider National, Inc. (SNDR)",0
UDR upgraded to overweight from sector weight at KeyBanc Capital,1
Take-Two downgraded on murky game slate,0
Intelsat Shorts Stick to Positions Even After Record 75% Wipeout,0
$SCANX: Large cap notable movers of interest -- BioNTech (BNTX) pulls back on above average volume,0
Why ADMA Biologics Is Tumbling 13.5% Today,0
Do You Like Oracle Corporation (NYSE:ORCL) At This P/E Ratio?,2
Grupo Aeroportuario reports 10% increase in January traffic,1
CRISPR Therapeutics among healthcare gainers; Plus Therapeutics leads the losers,2
"Traders are worried after seeing Canada's ""terrible"" jobs numbers",0
"$SUMRX: European Markets Update: DAX +4.1%, FTSE +3.8%, CAC +3.1%",1
Colombia suffered more unrest as anti-government protesters returned to the streets,2
$AAPL - Apple forecasts 100M+ 5G iPhone sales - report,1
"ICYMI, is now on Nasdaq $VIAC! 👋 to …",2
Uber's stock surges 7.9% premarket toward 6-mo. high after Q4 results late Thursday,1
The Best Cities for Frequent Flyers – 2019 Edition,2
"$EC: Ecopetrol plans to invest an expected $4.5-5.5 bln in 2020, 25% to 53% higher than the estimated 2019 figure...",2
Macy's Q3 adj. EPS 7 cents; FactSet consensus breakeven,1
Phathom Pharmaceuticals EPS of -$9.30,0
Canadian provinces on board with AbbVie's Skyrizi,2
Oil lower but trims early loss as report on China trade talks sparks fresh hope,1
"Fluidigm EPS beats by $0.06, beats on revenue",1
Assembly Bio down 6% premarket on pricing public offering,0
Uber Technologies : Safety Report Details Sexual Assaults in U.S. Over Two Years -- Update... #UberTechnologies…,2
Kodak Is Having a Comeback Moment as Oscars Embrace Film,1
Stock Market Update: Facebook seeing increased buying interest,1
Coronavirus crisis spells trouble for many Egyptian breadwinners #economy #MarketScreener,0
"😷 Children will experience more health problems like diarrhea than their parents as a result of global warming, acc…",2
How Many China Mengniu Dairy Company Limited (HKG:2319) Shares Do Institutions Own?,2
AbbVie : Form 8.3 - #AbbVie #Stock #MarketScreener,2
Belden stock price target raised to $56 vs. $54 at SunTrust Robinson Humphrey,1
Lackluster U.S. retail sales cast shadow on fourth-quarter economic growth,0
The US economy just gave Trump leverage by,2
Gundlach: Trouble Brewing In Debt Markets As The 'Real Turmoil' Is Only Beginning,0
Nasdaq climbs 0.3%,1
China Zheshang Bank : ARTICLES OF ASSOCIATION #Stock #MarketScreener,2
$MARK strong into the close..... news coming?,1
A Look At The Intrinsic Value Of Want Want China Holdings Limited (HKG:151),2
Citi gives big boost to Deere PT,1
$CGC - Canopy Growth: Falling Apart During Leadership Void. Get more info on Seeking Alpha:,0
Evercore downgrades bluebird bio and Clovis in premarket analyst action,0
Stock Market Update: Wall Street closes little changed after Phase One deal reached,2
South Africa could fall deeper into junk territory after S&P cut the outlook on its assessment of the nation’s debt…,0
China Readies U.S. Dollar Bond Sale #taux #MarketScreener,2
$KRTX - Karuna Therapeutics: Fundraising Makes For Buying Opportunity. Continue reading: #markets #business #economy,1
Twitter : Statement of Changes in Beneficial Ownership #Twitter #Stock #MarketScreener,2
Canada Goose's stock tumbles after revenue outlook slashed as coronavirus has 'material negative impact',0
$FOX $FOXA - Fox sells out Super Bowl ad slots early,2
$MARK nice volume...... after-hours could be fun !!! Next 50c,1
"Tonight's business headlines: ▪ US markets close higher, but post weekly losses ▪ Tesla shares down after unveilin…",2
$EDU - New Oriental -4% after rival discloses employee wrongdoing,0
UPDATE 2-Major FirstGroup shareholders call for U.S. asset sale,2
Nike to take $425 million charge to move brand business in South America to distributors,2
Belden stock price target raised to $56 vs. $54 at SunTrust Robinson Humphrey,1
Ciena stock price target raised to $47 vs. $43 at Instinet,1
UDR upgraded to overweight from sector weight at KeyBanc Capital,1
Funko stock price target cut to $10 from $25 at Stifel Nicolaus,0
"$ELVT - Elevate Credit EPS beats by $0.03, misses on revenue",2
The ECB dived into the fight to save the economy with 34 billion euros of bond purchases last week,2
21Vianet Group misses on revenue,0
The U.S. Navy sailor who fatally shot two people at Pearl Harbor before killing himself was unhappy with his comman…,2
Fintech company Bill.com surges more than 60% in market debut,1
"$OMF - OneMain Holdings EPS beats by $0.21, beats on revenue",1
Fiat Chrysler's profit rises ahead of Peugeot merger,1
"Highlight: ""Furniture has gotten smarter because it needs to work double time,"" Queer Eye's says. ""There…",2
CPI Inflation Surges To 5.54% In November,0
Dow up 0.2%; S&P 500 rises 0.1%,1
While market strain triggered by the coronavirus pandemic has eased since the Federal Reserve's historic interventi…,1
Lovesac stock price target cut to $28 vs. $33 at Canaccord,0
"In its 2020 equity outlook, Goldman predicts the S&P 500 will rise by 5% to 3250 in early 2020. ""However, rising po…",1
Financial Leasing Sector in Serbia & Third Quarter Report 2019 #Stock #MarketScreener,2
TJX Q3 HomeGoods same-store sales up 1%; FactSet consensus up 1.7%,1
"UBER, NLOK among premarket gainers",1
Here’s what bugs Democratic presidential candidate Michael Bennet about the front-runners b…,2
Chairman Jerome Powell speaks after Fed leaves interest rates unchanged,2
"Stocks edge higher, but S&P 500 ends six-week streak of weekly gains",1
"US Gasoline Crashes To 50c - Lowest Since 2001 - Amid ""Unprecedented"" Demand Collapse",0
Jet fuel demand takes a hit as coronavirus leads to travel restrictions,0
"Dow, S&P 500 turn positive",1
Ted Baker Chairman David Bernstein and CEO Lindsay Page are quitting after the British retailer slashed its full-year earnings…,0
Coty to take a 51% stake in Kylie Cosmetics for $600 million,2
"$TSLA - Tesla's New Pickup Is Ugly, Sell; Also Week-End Rally Pattern Holding But Weakly. Get more updates here:…",0
Falling Oil Prices An Economic Warning Sign | Zero Hedge,0
Stocks close lower after trade creates choppy session by,0
$AMGN - Partial response in Amgen brain cancer study,0
"'Music is life, music is everything to me.â€ Rapper gets candid in his conversation with about sne...",2
Gold prices settle higher for a second straight session,1
"S&P flat, Dow down after disappointing retail results",0
Pound falls as Boris Johnson taken to intensive care for COVID-19 by,0
"Dozens of U.K. retailers have been forced to close stores and slash rents as they compete with online rivals, sendi…",0
$AYX - Alteryx Stock Price: More Downside Before Taking Off. Continue reading: #business #investing #economy,0
"What are the biggest economic or political risks in 2020? Former U.S. Economic Adviser Gary Cohn, Gro Intelligence…",2
SB Financial announces extension of share repurchase program,1
Trump threatens China with higher tariffs if trade deal not made,0
USDA United States Department of Agriculture : Secretary Perdue Statement on USMCA Agreement #USDA #economy…,2
Marine Petroleum Trust declares $0.0488 dividend,2
Barclays analysts says Uber and Lyft are well-positioned to achieve profitability,1
Brasileiro S A Petrobras : Petrobras on new oil discovery in Campos Basin #Stock #MarketScreener…,1
"S&P 500 down fractionally, about 2 points, at close",0
Hedge Funds Are Dumping Cedar Realty Trust Inc (CDR),0
"Results: Jack Henry & Associates, Inc. Exceeded Expectations And The Consensus Has Updated Its Estimates",1
Why this bull market may have no teeth left,0
Germany Supports Rescue Loan For Italy Through Euro Area Bailout Fund,1
Can Kirkland Lake Gold Ltd. (TSE:KL) Maintain Its Strong Returns?,2
Is Jazz Pharmaceuticals plc's (NASDAQ:JAZZ) CEO Paid At A Competitive Rate?,2
Berry Petroleum's stock plunges to 2-year low after California prohibits using steam to extract oil,0
IAA Appoints Gail Evans to Board of Directors,2
Important note about this performance: Sean entered the contest late and didn't start trading until almost have th…,2
STOCKS NOW: - Dow up 120.52 points - Nasdaq up 4 - S&P up 5.91,1
FleetCor stock price target raised to $325 from $310 at CFRA,1
Clorox declares $1.06 dividend,2
$LK - Citron and Muddy Waters at odds over Luckin Coffeee,0
"Oil - If Demand Drops, Exports Drop. #markets #stockmarket #investing",0
Hedge Funds Have Never Been Less Bullish On Southwestern Energy Company (SWN),0
Buy The Trade Desk Stock on Dips Heading Into 2020,2
Here are some of the business tax credits Congress could approve by year’s end,2
NXP Semiconductors stock price target raised to $139 vs. $128 at SunTrust Robinson Humphrey,1
Wipro赢得Marelli的多年战略性IT协议,2
Africa Capitalworks picks up minority stake in drinks maker Gaselia,2
$GM - GM loses a bull,0
$PSCF - Invesco S&P SmallCap Financials ETF declares $0.47 dividend,2
"$ELY - Callaway Golf EPS misses by $0.03, beats on revenue",2
"Earnings Update: Here's Why Analysts Just Lifted Their Aemetis, Inc. Price Target To US$2.25",1
Japan declares state of emergency #economy #MarketScreener,0
Stock Market Update: ConocoPhillips forecasts $50 billion free cash flow over ten years,1
Cofinimmo : BlackRock - Transparency notification #Cofinimmo #Stock #MarketScreener,2
JPMorgan restructures ETF sales,2
7 Heavily Shorted Stocks That Could Pop on a Short Squeeze,2
Deutsche Bank shares soar after new shareholder steps in,1
A Look At The Intrinsic Value Of Want Want China Holdings Limited (HKG:151),2
U.S. shale gas investors brace for write-downs amid price plunge,0
China’s State Grid Nears Oman Electricity Stake Purchase,2
$SCANX: Mid cap notable movers of interest -- Kohl's (KSS) advances off of recent lows,1
Does Mimecast Limited (NASDAQ:MIME) Have A Particularly Volatile Share Price?,2
CNFinance reports Q3 results,2
Royal Mail Labor Troubles Put Long-Term Targets in Jeopardy,0
Trump Vengeance Illuminates Legislative Branch Weakness (Radio),2
Everything That's Wrong About The IEA Oil Market Report. #stockmarket #stocks #trading,2
Coloplast ASB reports Q1 results,2
$AUPH holding it till $25 :),2
"Technical Indicator: Late-year bull trend confirmed by S&P, Nasdaq",1
GoldON Resources : Grants Incentive Stock Options #GoldONResources #Stock #MarketScreener,2
China’s Coronavirus Death Toll Rises to at Least 563,2
The pound is ending a tumultuous month on a high note just hours before Britain exits the European Union,1
It looks like $CPHI could be a stock that deserves your attention going forward.,1
Hedge Funds Are Warming Up To Canadian Imperial Bank of Commerce (CM),1
Hedge Funds Have Never Been More Bullish On RadNet Inc. (RDNT),1
"With Tiffany, LVMH grows in jewelry. And Tiffany gets another chance to shine",2
Taylor Caswell on the Political Impact of New Hampshire's Economy,2
Buenos Aires Surrender Sends Argentine Bonds on a Wild Rally,1
U.S. House Democrats claim victory in revamping U.S.-Mexico-Canada trade pact #economy #MarketScreener…,2
Facebook under fire as political ads vanish from archive: FT,0
Helmerich & Payne started at sell with $34 stock price target at Deutsche Bank,0
Here's Why We Think Ohio Valley Banc (NASDAQ:OVBC) Is Well Worth Watching,2
Gilead an acquisition target? Deep pockets required,2
Santa Monica hotel built without permits can remain open,2
"Gold is going to $2,500, $3,000 an ounce: investment expert",1
Macerich downgraded to underweight from sector weight at KeyBanc Capital,0
Black Friday shopping guide — What not to buy by,2
PG&E Faces a Sprint to Fix Restructuring After Governor’s Rebuke,2
Public Joint Stock Company Gazprom Neft reports Q3 results,2
Jobless Americans to see extra payments as soon as this week #economy #MarketScreener,1
$JD: Barclays ups to Overweight,1
$VIVE - Viveve Medical prices unit offering,2
General Motors' Q4 Profit Beat Estimates Despite Huge Strike Costs,1
China Unicom (Hong Kong) Limited’s (HKG:762) Investment Returns Are Lagging Its Industry,0
From : Why Italy and France have bad economic headaches,0
La Jolla Pharma to reassess development of LJPC-401,0
HSBC agrees to pay $192 million to resolve U.S. tax probe via,1
Trucking companies failing at nearly triple the rate of 2018,0
Janet Yellen says second-quarter GDP could decline by 30% and unemployment is already at 12%-13%,0
100% Correct!,2
"Highlight: “You don’t copy Amazon, you learn the best practices,” author Ram Charan says. “It has three key element…",2
Conference Board's Employment Trends Index Rises in January #economy #MarketScreener,1
3 Top Value Stocks to Buy in February,2
$GNMK - GenMark Q1 revenue up big on COVID-19 boost; shares up 29% after hours,1
Efforts to save South African Airways by placing it into bankruptcy protection hit a snag,0
"U.S. Xpress EPS beats by $0.04, beats on revenue",1
New wind farm financing in Europe to face delays in 2020: report,0
Fantasia : FURTHER INFORMATION IN RELATION TO THE CO-OPERATION AGREEMENT WITH SHENGYUAN #Stock #MarketScreener…,2
Brasileiro S A Petrobras : Petrobras on new oil discovery in Campos Basin #Stock #MarketScreener…,1
"NIO appoints new CFO, shares up 6% premarket",1
"The China-driven growth in beef consumption may soon be over, shows (via )",0
Brazilian food delivery app iFood looks to grow in retail in 2020,1
"Stocks could rocket higher from here, history shows: Morning Brief by",1
Natural gas production in the U.S. is expected to drop by the fastest pace ever next year,0
JUST IN: 2 people are in custody after authorities fired shots at an intruder vehicle outside Trump's Mar-a-Lago cl...,2
$TOPS TOP Ships (TOPS) Stock Is Rocketing For Multiple Reasons via,1
Gold Prices Inch Up; Trade Talks Remain in Focus,1
STOCKS AT THE CLOSE: - Dow up 0.39% - Nasdaq up 0.16% - S&P up 0.21%,1
General Motors' Q4 Profit Beat Estimates Despite Huge Strike Costs,1
Stocks start with solid gains; tech a strong early leader,1
BJ's Wholesale cuts same-store sales outlook to up 1.3%-1.5% from up 1.5%-2.5%,0
"$ADRO - Aduro adds to rally as bargain hunters move in, shares up 18%",1
"American Water CEO Susan Story Announces Retirement for April 1, 2020",2
"Hypothecation: Meaning, Risks, and Examples",2
MMG Consumer Brands Adds CPG Executive Nicole Butera as Product Development Manager,2
