text,label
Quant pioneer Winton suffers in coronavirus-driven sell-off,0
WATCH: Protesters took to the streets of Rome demanding the Italian government take action to stop violence against…,2
PBOC Will Resolve Risks Gradually as Downward Pressure on Chinese Economy Has Increased #economy #MarketScreener…,2
The mood is upbeat on markets ahead of Thanksgiving #Stock #MarketScreener,1
Wayfair shares surge 37% as coronavirus drives sales of office furniture and home decor,1
California Intensifies Fossil Fuel Fight With Drilling Ban,0
"Twitter Beats Revenue, User Growth Estimates; Shares Rally",1
Memebox Rebrands to MBX and Names New Executive Team,2
$XLF $FAS $FAZ - Banks may face legal actions over margin calls - FT,0
"Morgan Stanley upgrades Nvidia to buy, predicting 2020 will be 'a return to solid growth'",1
Student loan reform group sues Education Secretary Betsy DeVos and CFPB Director Kathy Kraninger…,2
"$XPO - XPO Logistics tops Q4 earnings view, hires Wyshner as new CFO",1
"Demand for HK Property Is Very Strong, Says Midland Realty's Lau",1
$NVTA (+5.4% pre) Invitae Announces Exercise in Full of Underwriters' Option to Purchase Additional Shares of Commo…,1
"Mohawk Industries, Inc.'s (NYSE:MHK) Earnings Dropped -19%, Did Its Industry Show Weakness Too?",0
$WORX breakout on volume. Could squeeze into the close.,1
Coronavirus Hits Oil's Weakest Credits Hardest,0
Is Otter Tail Corporation's (NASDAQ:OTTR) High P/E Ratio A Problem For Investors?,2
Kohl's cuts annual profit forecast after disappointing results; shares slump,0
Kudlow calls U.S.-China deal 'close' as talks in 'intense' phase,1
Casper ends first day of trade up 13%,1
Biofrontera : english #Biofrontera #Stock #MarketScreener,2
Uber co-founder Travis Kalanick has sold $1.5 billion worth of the company's stock this month,0
"Hedge Funds Are Selling Axos Financial, Inc. (AX)",0
The Expected and Thrilling Resolution of Oil’s Consolidation,2
Sinclair Broadcast -1.9% as Stephens cuts target,0
McDonald's could sell over 250 million Beyond Meat burgers in U.S. annually: UBS,1
JUST RELEASED: Oil Price Dynamics Report Oil prices rose over the past week owing to decreased supply.…,1
A Sliding Share Price Has Us Looking At Chi Ho Development Holdings Limited's (HKG:8423) P/E Ratio,0
China Fears Are Still Propelling Gold Demand. #stockmarket #economy #markets,1
"Trump is considering executive action to cut drug prices ahead of the 2020 election, officials familiar with the ma…",2
Analysis: Popeyes Chicken Sandwich Translates To Surge In Foot Traffic,1
"PMC Bank Depositors Held After Protest, CM Assures Help To All",2
"Historically, a down January significantly increases the odds of a down year. These is the S&P's January and full y...",0
Business owner sues Target for copyright infringement,0
This Pig Farmer Is The World’s Fastest-Rising Billionaire,2
Gold Prices Inch Up; Trade Talks Remain in Focus,1
"The ‘great rotation’ will arrive in 2020 and bring another strong year for stocks, JP Morgan says",1
$UBFO - Tough Operating Environment Poses A Threat To United Security Bancshares. Read more and get updates on any…,2
Nordic Semiconductor ASA reports Q4 results,2
Why the chances for a 'V'-shaped economic recovery are getting less likely by the day,0
"S&P 500 headed for a 67% downturn? Seems ‘preposterous’ now but so did similar pullbacks begun in 2000 and 2007, sa…",0
If You Like EPS Growth Then Check Out John Bean Technologies (NYSE:JBT) Before It's Too Late,2
$EPR - EPR Properties sells Charter School portfolio for $454M; lowers FFO guidance for 2019,2
Merck's Keytruda OK'd in Europe for first-line HNSCC,1
$MCIG - MCig up 9% on CBD distribution deals,1
Semis Vs. Energy - A New High. #stocks #finance #trading,1
"Are You Invested In These 3 Mutual Fund Misfires? - February 06, 2020",2
"JPMorgan Chase chief Jamie Dimon said he expects the coronavirus crisis to include a ""bad recession"" and elements o…",0
Volkswagen reveals exotic-sounding ID. Space Vizzion electric wagon at Los Angeles Auto Show,1
"$STE - Steris EPS beats by $0.03, beats on revenue",1
Government data showed hiring saw the biggest surge in 10 months in November. Employers added a much stronger-than-…,1
Stocks open lower amid fears of trade impasse,0
Highwoods Properties : SCHEDULE 13G #HighwoodsProperties #Stock #MarketScreener,2
"Bitcoin: A Drop Below $8,000 Opens the Doors Toward $5,000",0
Samoan families are hanging red flags outside their homes to request urgent measles vaccinations. The outbreak has…,2
"U.S. Treasury, Fed working on 'Main Street,' municipal loan facilities - Mnuchin #economy #MarketScreener…",2
Mexico Official Complains About 3-Way Trade Deal in Tweetstorm,2
L'Oreal Expects Short-Term Virus Hit,0
"Lovesac EPS misses by $0.04, misses on revenue",0
Unilever Plunges 8% After Disappointing Guidance Update,0
Philippine nickel miners and Chinese battery makers are exploring a potential collaboration ahead of Indonesia's ba…,2
Highlight: CEO Mike Mussallem and CEO Martin Whittaker on stakeholder capitalism:,2
Why Shake Shack Stock Gained 13% in January,1
"This 24-year-old is earning $230,000 a year—here are the 3 steps he's taking to become a millionaire by 30. (via…",2
$ATOS impressive move here....,1
"President Xi Jinping calls China’s sprawling belt and road initiative the ""project of the century,"" but many challe…",2
Coty +5% after striking Kylie Jenner deal,1
Small-Company Stocks Have Been Lagging the Market. Here's Why That Could Change Soon - MONEY,1
Evercore downgrades bluebird bio and Clovis in premarket analyst action,0
$SCANX: Small cap notable movers of interest -- Mesoblast (MESO) gains on clearance of remestemcel-L IND,1
$OVV - Ovintiv: Anticipating A Dividend Cut. #stocks #finance #trading,0
"$LEVI: Levi Strauss beats by $0.05, beats on revs",1
Dubai's Jobs Vanish at the Fastest Pace in a DecadeÃ‚Â,0
$AMTD (+1.3% pre) Charles Schwab $SCHW to buy TD Ameritrade in $26 billion all-stock deal - Reuters,1
Axonics launches $110M equity offering; shares down 3% after hours,0
First Savings Financial reports Q1 results,2
Mid-Afternoon Market Update: NASDAQ Rises Over 2%; Myomo Shares Spike Higher,1
"Is Energy Recovery, Inc. (ERII) A Good Stock To Buy?",2
Medtronic +2% premarket on FQ2 beat,1
Edited Transcript of YRD earnings conference call or presentation 15-Nov-19 12:00am GMT,2
Nasdaq-100 futures up 0.4% after data,1
Nigeria's government plans to raise as much as $6.9 billion from multilateral lenders to offset the impact of the C…,0
Nokia stock price target raised to $6.00 from $5.50 at MKM Partners,1
Stocks start with solid gains; tech a strong early leader,1
The 3rd HK Store of “A Happy Pancake” Finally Opens!!,2
"Dubai economy grew 2.1% in first half of 2019, says Emirate's Media Office",1
". is the darling of the decentralized finance movement. Unlike its competitors, it's backed not by other g…",2
Gold prices slip after hitting more-than-6-year high,0
Tinyclues accélère sa croissance en 2019,2
FDA OKs Tandem's Control-IQ; shares up 1%,1
RPM International stock price target raised to $79 vs. $75 at BofA Merrill Lynch,1
"China sets tougher guidelines to protect patents, copyrights",2
Dow stock price target raised to $52 vs. $46 at BofA Merrill Lynch,1
Apparel stocks tumble after a pair of disappointing earnings,0
Aytu Bio's FQ1 miss-stoked selloff continues; shares down 17% premarket,0
$COMDX: Energy Settlement Prices,2
What the Disney+ ‘hack’ should teach you about your own security by,2
HSBC Plans Third Overhaul in a Decade With Investors Seething,2
A 2020 gift guide for the tech-savvy traveler,2
Illinois risk seeing its credit rating cut to junk,0
Acorn Capital Investment Fund : Dividend Reinvestment Plan #AcornCapitalInvestmentFund #Stock #MarketScreener…,2
Japan Recession Risks Prompt Forecasts of 2020 Contraction,0
Tesla Inc. slumped in pre-market trading after the electric carmaker’s newly unveiled pickup truck elicited mixed r…,0
Trade Alert - Crude Oil Downside. Read more: #investing #stockmarket #trading,0
Schweizerische Nationalbank : Switzerland Loses Grip on World's Lowest Borrowing Costs -- ...…,0
More records in store at the open,2
Goldman's Currie Sees Worst Oil Demand Shock in a Decade,0
Canada’s Labor Market Picks Up Steam for Second Month,1
Deutsche Bank has agreed to pay €15 million in penalties to end a probe into possible money-laundering and tax evas…,0
Stocks bounce up after China confirms trade deal with U.S.,1
Brent +4%,1
"United Bankshares to buy Carolina Financial for a 16% premium, in a deal valued at $1.1 billion",2
Barings Corporate Investors declares $0.30 dividend,2
$RIO $ACH $TRQ - Rio Tinto says virus slowing copper ore shipments from Mongolia,0
The U.S. House voted to require states with a history of voter suppression to get federal approval for election-law…,2
$RUTH - Ruth's Hospitality Group (RUTH) Investor Presentation - Slideshow. Read more: #economy #stockmarket #stocks,2
Dow and S&P 500 open at records as China cuts tariffs,1
"$ZFGN Holding nicely its EMA50. With more than $2 per share in cash, a run to +$1 is likely at this point.",1
Funds Look to Take Down New Zealand Dollar After Runaway Gains,0
$TRGP rising late w/ another 800 Jan $37 calls trading,1
VIVUS up 8% premarket on positive Qsymia effect in binge-eating disorder,1
WATCH: Why is 2019 on pace to be the largest year ever for healthcare technology? Investment Banking…,1
Don't let your family eat themselves sick this Thanksgiving.,2
Strong demand for the small business relief program is “a really good sign for what the economy might look like 2-3…,0
PG&E loses half of financial backing for bankruptcy plan,0
"As Uber, GrubHub and Postmates battle over cities, Doordash is thriving in the suburbs",1
"CBI Detected 894 Shell Companies In Four Years, Government Says",2
Berry Petroleum downgraded to market perform from outperform at BMO Capital,0
$CAMT - Camtek surge 8% as Q1 shipments in-line with guidance,1
TransDigm trades lower post mixed Q4 results; guides FY20 below consensus,0
Miners Are Facing Challenges Globally,0
"BDX, GLOP among premarket losers",0
$MPLX $MPC - MPLX cut at Credit Suisse on potential dilution from Marathon strategic review,0
$CLVS the squeeze continues........,1
"What Does Crown Holdings, Inc.'s (NYSE:CCK) P/E Ratio Tell You?",2
AutoZone has benefited from a variety of factors such as a healthy U.S. consumer and more older vehicles on the road,1
Experts say identifying state media outlets can be incredibly difficult and resource intensive — and they are urgin…,2
"Twitter tops expectations with first $1 billion quarterly revenue, but outlook lags",1
Increase Your Credit Score With This 1 Trick,2
$XERS - Xeris Pharma launches equity offering; shares down 3% after hours,0
Imagination TV announces new share buyback program,1
SPDR S&P Retail ETF down 1.3% in premarket trading,0
$CVX - Chevron CEO planning major cost-cutting initiative - Reuters,2
$BYND - JPMorgan reels in expectations on Beyond Meat,0
CF Industries stock price target raised to $56 vs. $52 at BofA Merrill Lynch,1
8 Industrials Stocks Moving In Monday's Pre-Market Session,2
AT&T $T says 'it has a strong cash position' and will continue to pay a quarterly dividend.,1
$AXAS - Abraxas Petroleum: Poor Liquidity Points To A Chapter 11 May Be On The Horizon.,0
Asian Markets Slip as Trump Threatens Higher Tariffs,0
"Swiss Currency, Javid’s Ambitions, China Cuts Tariffs: Eco Day",2
BRP Inc. (TSE:DOO) Earns Among The Best Returns In Its Industry,1
"Paschi Misses Full-Year Income Target, May Cut Costs More",0
Pyxus International among consumer gainers; Tupperware Brands and Fossil among losers,2
Baxter International : Gets NYSE Notice Regarding 10-Q Filing #BaxterInternational #Stock #MarketScreener…,2
Amazon sues U.S. over loss of Pentagon cloud deal to Microsoft,0
Deluxe delivered record FY2019 revenue,1
South Africa could fall deeper into junk territory after S&P cut the outlook on its assessment of the nation’s debt…,0
$MDXG - MiMedx settles VA pricing investigation; shares up 6%,1
"Total beats quarterly forecasts, lifts dividends despite low oil price",1
EUR/USD Weekly Price Forecast – Euro Slams Into Major Resistance,0
EURUSD remains below broken swing area - ForexLive,0
". on jobs number? ""Phenomenal""",2
"Toyota lifts profit outlook, mulls alternatives to China-made parts amid virus outbreak",1
Mercury General : Insurance Urges Americans to Take Extra Precautions to Secure Home Netwo... #MercuryGeneral…,2
$XLNX - Mizuho cuts XLNX target on near-term headwinds,0
"Rada Electronics EPS in-line, misses on revenue",2
STOCKS NOW: - Dow down 432.22 points - Nasdaq down 111.22 - S&P down 43.90,0
"Energy names lag on lower commodity prices for oil, gas",0
The #market is seeing strong #tax-loss selling. #Investors who focus on price action are worried.…,0
Yara International reports Q4 results,2
"With the good news that came out today, you think that once the markets opened it no longer was good? It’s still go…",2
China's divorce rate spiked as couples emerged from quarantine - and it's a warning to the rest of the locked-down…,0
Adocia Announces Its Financial Calendar for 2020,2
$VLRX volume pop,2
The high in WTI in September following the drone strikes on Saudi oil facilities was 63.40. Crude oil right now is at 63.38.,1
U.S. growth outlook in 2020 improves despite trade risk: Fannie Mae,1
Investors Who Bought GlobalSCAPE (NYSEMKT:GSB) Shares Five Years Ago Are Now Up 302%,1
Justice Department indicts four members of China's military for Equifax hack,2
U.S. deficit soars to $342 billion in two months via,0
Atlas Air +9% after Wolfe Research lift,1
London Stock Exchange : Form 8.3 - #LondonStockExchange #Stock #MarketScreener,2
Why Credit Suisse Sees the S&P 500 Gaining 10% in 2020,1
$PYPL - Coronavirus Won't Hinder PayPal's Growth. #economy #business #stockmarket,1
$LOW - Lowe's racks up another positive rating despite recession risk,1
One Thing To Remember About The Silicon Motion Technology Corporation (NASDAQ:SIMO) Share Price,2
Salarius Pharma down 53% premarket after pricing equity offering,0
"Danaos EPS beats by $0.34, beats on revenue",1
Patterson-UTI Energy started at sell with $7 stock price target at Deutsche Bank,0
Royal Mail Labor Troubles Put Long-Term Targets in Jeopardy,0
Yum Brands Q4 same-store sales up 2%; FactSet consensus up 2%,1
Stock Market Update: WTI crude falls back below $50 per barrel,0
"Oil is down, gold is up. Rates are flashing warnings. But someone forgot to tell stocks",0
Puxin reports Q3 results,2
"Comparable sales missed estimates at Home Depot, shares down 4.6% premarket",0
"$ASPU - Aspen EPS beats by $0.04, beats on revenue",1
Investors cheered the blockbuster November jobs report,1
Business owner sues Target for copyright infringement,0
"NanoViricides : Annual Meeting of Shareholders to be Held on Saturday, December 7th, 2019 ... #NanoViricides #Stock…",2
$CMCSA $LHX - Comcast sues L3Harris in patent dispute,0
$LSCC - Lattice Semiconductor Delivering Early On Several Key Promises. Continue reading:,1
Sparkle fades as coronavirus risks wiping out luxury goods growth,0
Edited Transcript of ARWR earnings conference call or presentation 5-Feb-20 9:30pm GMT,2
"Lower oil prices typically boost global growth, but the recent decline to an 18-year low will likely provide less s…",0
"i3 Verticals EPS beats by $0.01, beats on revenue",1
Hedge Funds Are Warming Up To Canadian Imperial Bank of Commerce (CM),1
"Goldman Says 36,000% Rally in Brazilian Retailer Has Room to Run",1
"All major indexes finished the day in the green, as the number of new coronavirus cases in the U.S. appeared to slo…",1
"Loss of working hours to equal 195m full-time jobs, UN agency warns",0
Yum Brands Q4 Pizza Hut same-store sales down 2%; FactSet consensus down 0.9%,0
"Tesla's stock fall premarket; RBC reiterates bearish view, but warns not to short",0
Canada Goose stock price target cut to $50 from $65 at CFRA,0
"The next downturn will be a ""smorgasbord recession,"" Paul Krugman said.",0
$MYO off $SONN low float mania is back !!!,1
"""I’ve owned the Apple Card for 3 months…this is why it sucks.""",0
South Africa’s Economic Freedom Fighters Party Keeps Top Leaders,2
"November 22, 2019 States, the Supreme Court & Sales Taxes: How to Prepare for 2020 Annual ... #ChannelAdvisor…",2
Total S.A. declares EUR 0.68 final dividend,2
What Boris Johnson and Jeremy Corbyn are promising for the Christmas Brexit election,2
"The outlook for Finland's economy has dramatically worsened due to the coronavirus outbreak, with the country's cen…",0
PriceSmart reports 0.3% gain in comparable sales,1
How Many The Clorox Company (NYSE:CLX) Shares Do Institutions Own?,2
Oil majors cut 2020 spending by 22% after prices slump #CNOOC #Stock #MarketScreener,0
"Euro Slumps to 4-Month Low Amid Weaker Data, Virus Fallout Fears",0
Hopes Dim for Broad Deal on Global Carbon Market at UN Talks,0
Zscaler +2.6% on new bull ahead of earnings,1
Aurora Cannabis says 94% of holders of its C$230 million in convertible debt opt for early conversion,2
Stock Market Update: U.S. offers to cut existing tariffs and cancel Dec. 15 tariffs,1
"$BAYRY $BAYZF - Bayer, plaintiffs agree to postpone glyphosate lawsuits for settlement talks",1
Gold Price Forecast - Gold Markets Recover After Initial Selloff - FX Empire,1
Here's what's moving stocks into the close:,2
VIVUS up 8% premarket on positive Qsymia effect in binge-eating disorder,1
'Unfit' Uber stripped of London license #economy #MarketScreener,0
"Western Digital is ""flashing"" green, adding to the hope that the flash market is improving (WDC) $WDC",1
"BCE EPS misses by $0.01, misses on revenue",0
ICYMI: 81% of U.S. small businesses are 'nonemployer' firms — meaning they have no employees other than the owner(s…,2
Why China's coronavirus is more dangerous for the global economy than SARS was in 2003 via,0
Uber's stock surges 7.9% premarket toward 6-mo. high after Q4 results late Thursday,1
ViacomCBS rang the opening bell at the Nasdaq this morning after CBS and Viacom completed their merger yesterday.,2
"Central European Media Enterprises Ltd. Reports Results for the Full Year and Fourth Quarter Ended December 31, 2019",2
IFF to Merge with DuPont’s Nutrition & Biosciences Business,2
"Weekend Review, 11/24: Confirmed Uptrend Both major indexes are down for the week, breaking 7 consecutive up weeks…",0
Coca-Cola brings back CMO role,2
Aurora Cannabis (NYSE:ACB) Stock Dives Breaking Key Support - Live Trading News,0
"Stifel Upgrades Wendy's, Bullish On Breakfast And Digital Prospects",1
CymaBay Therapeutics shares down 77% premarket after resuming trade following halt,0
$NSSC: Napco Security Systems sees Q3 revs below consensus,0
The amount of electricity generated from coal jumped 7% in the developing world last year,1
"The Fed announced a massive second wave of initiatives to support the U.S. economy, many specifically targeting com…",2
And now we sell,0
U.S. Claims for Jobless Benefits Fall to Lowest Since April,1
Walmart has announced that it plans to open 500 new stores in China over the next five to seven years. That would m…,1
Materials Up After Xi's Comments On Trade Relations -- Materials Roundup #economy #MarketScreener…,1
$VG - Vonage Holdings (VG) Investor Presentation - Slideshow. Sign up for updates on Seeking Alpha!…,2
Abiomed defends Impella after critical study; shares ahead 5%,1
In 1.60 $NYMT on news 6000 shares. Stock fell 80% and now can run big,1
GBP/JPY Price Forecast – British Pound Fails To Break Out,0
Sirius downgraded on valuation,0
IRAQ DIDN'T AGREE TO MORE OIL CUTS DUE TO SAUDI PRESSURE: MIN,2
Elastic upgraded to buy from hold at Canaccord Genuity,1
Global stocks stutter at end of best week since June,0
Babe Ruth's 500th Home Run Bat Sells for More Than $1 Million,2
Brazil tropical fruit exports to EU hit by coronavirus - industry group #economy #MarketScreener…,0
Ameritrade-Schwab approval may take up to 10 months - Morgan Stanley,2
"Nvidia $NVDA said it sees fourth-quarter revenue in the region of $2.95 billion, with a margin for error of 2%",2
NVIDIA : Shares up 5%; Morgan Stanley Upgrades to Overweight #NVIDIA #Stock #MarketScreener,1
AbbVie +4% premarket on Q4 and guidance beat,1
Uber Loses License In London,0
Iranian Strike on U.S. Forces Roils Markets #index #MarketScreener,0
The U.S. Navy sailor who fatally shot two people at Pearl Harbor before killing himself was unhappy with his comman…,2
Texas Instruments stock price target raised to $125 vs. $122 at SunTrust Robinson Humphrey,1
The economic costs of the coronavirus contagion have started to show up in the data for the Middle East…,0
TODAY: The U.K. is officially leaving the EU after 47 years in the bloc #BrexitDay,2
Saint-Gobain North America Announces Largest Renewable Energy Deal in Company’s 354-Year History,1
TransDigm trades lower post mixed Q4 results; guides FY20 below consensus,0
"CNBC-TV18 Market Highlights: Sensex ends 163 points higher, Nifty holds 12,100; PSU bank index up 2.6% - CNBCTV18",1
Amazon seeks testimony from Trump in cloud contract appeal,2
HSBC agrees to pay $192 million to resolve U.S. tax probe via,1
"Mediaset set to win more time to complete merger of Italy, Spain units: sources",2
Nokia Shares Surge As Q4 Earnings Beat Analyst Estimates,1
Tesla Cybertruck debut drew ridicule online after the newly-unveiled model’s armored glass windows cracked like spi…,0
EUR/USD Daily Forecast – Euro Bounces From Support Area,1
$INPX is gaining momentum......,1
Quaker Lobby Hails House Passage of Voting Rights Advancement Act,2
After a early morning mishap on $SPY $ZM taking control here with $BA $AAPL $AMZN. $SPY $ZM both would be wins now too.,1
Can Kirkland Lake Gold Ltd. (TSE:KL) Maintain Its Strong Returns?,2
Red Flags Emerge in U.S. Stocks With Insiders Rushing to Sell,0
"Philippine Stocks May Pick Up Into Year-End on Profits, GDP",1
$MRNA trademark - WUHAN CORONA VAX,2
Behind hedge fund Bridgewater’s massive bet on a stock-market decline,0
Aravive rockets 263% premarket on promise of lead candidate,1
"Ford Stock Hit by CEO, China and Lack of Product",0
German Industry Slump Set to Cast Shadow on Economy Through 2020,0
Which Countries Spend The Most On Obesity?,2
Property Lenders Surge After India Central Bank Eases Cash Rules,2
"What Kind Of Shareholder Appears On The Evoke Pharma, Inc.'s (NASDAQ:EVOK) Shareholder Register?",2
$HP - More Pain In Sight For Helmerich & Payne. Sign up for updates on Seeking Alpha! #markets #investing #trading,0
Starbucks +2% after JPMorgan lift,1
"India's NAFED tenders to purchase 100,000 tonnes corn",2
Justice Department indicts four members of China's military for Equifax hack,2
New finance chief at Plus Therapeutics,2
U.S. Stocks Were Resilient Last Week As Coronavirus Roils China. #business #stocks #trading,1
"Prestige Brands Holdings EPS beats by $0.06, beats on revenue",1
Vietnam's budget carrier VietJet Aviation JSC will suspend all of its fights to China February 1 amid the novel cor...,0
Pound falls as Boris Johnson taken to intensive care for COVID-19 by,0
Canada’s ‘Big Six’ banks are staging a comeback,1
Scandinavian Tobacco Group A/S Earnings Missed Analyst Estimates: Here's What Analysts Are Forecasting Now,0
After a early morning mishap on $SPY $ZM taking control here with $BA $AAPL $AMZN. $SPY $ZM both would be wins now too.,1
Oil resumes decline as investors monitor back-and-forth trade talks,0
McDonald's is paying $26 million to settle a class action lawsuit over wage theft. It's the latest development in a…,1
"Wells Fargo downgrades Netflix: 'If content is king, then cash is queen'",0
NYSE direct listings proposal rejected by SEC,2
Volkswagen +2% after strong deliveries report,1
Get Excited About U.S. Economy And Stocks – Senate To Regain Tariff Powers,1
BJ's Wholesale Q3 EPS 40 cents vs. 39 cents a year ago,1
U.S. gasoline futures tumbled to their lowest level since 1999-with some pump prices already below $1-as coronaviru…,0
Asian Shares Mostly Higher; Hang Seng Jumps on Stimulus Expectations,1
$AMEN - AMEN Properties reports Q3 results,2
Shares of Wayfair $W jumped after the online furniture retailer said its revenue-growth rate more than doubled towa…,1
Nordic Semiconductor ASA reports Q4 results,2
Global Markets: Asian shares rise as 'phase one' trade deal fans confidence,1
News Highlights : Top Energy News of the Day #WTI #Stock #MarketScreener,2
"S&P, NASDAQ Reach New Closing Highs on 3rd Day of Rally",1
Dubai's Jobs Vanish at the Fastest Pace in a DecadeÃ‚Â,0
$TOPS $DECN Making me some $$$ Today,1
"Canada Goose Holdings EPS beats by C$0.01, beats on revenue",1
"Syanptics raised on forecast, margin strength",1
Finance Minister Begins Pre-Budget Consultations Starting Monday,2
Softbank leads $140 million funding round for Brazil start-up VTEX #economy #MarketScreener,2
Transocean started at sell with $3 stock price target at Deutsche Bank,0
This week in Trumponomics: Wowsa by,2
Alnylam Pharmaceuticals Reports Fourth Quarter and Full Year 2019 Financial Results and Highlights Recent Period Activity,2
Oil resumes decline as investors monitor back-and-forth trade talks,0
$VOYA - Voya Financial EPS beats by $0.04,1
BlackRock declares $3.30 dividend,2
Intel stock price target raised to $62 vs. $60 at SunTrust Robinson Humphrey,1
WTF???? Trey Gowdy? bad hair day?,2
Altria stock price target raised to $54 from $50 at Stifel Nicolaus,1
Clorox declares $1.06 dividend,2
$F - Ford Presents A Safe 6.6% Return With A High Margin Of Safety. Read more: #trading #economy #markets,1
"Stocks, Bonds, & Dollar Stumble As Traders Reach 'Peak FOMO'",0
Encounter Resources : AGM Chair Address and Presentation #EncounterResources #Stock #MarketScreener…,2
Amazon sues U.S. over loss of Pentagon cloud deal to Microsoft,0
